artist,lyrics,song_name,gender,POC
Maren Morris,"GIRL Lyrics[Verse 1]
Man, this shit's unflatterin', all up in my head again
I don't feel myself right now, maybe I should just lay down
If vanity's my vitamin, well, I don't feel the difference
I don't like myself right now, gotta find a way out

[Pre-Chorus 1]
What you feel is natural
But I don't wanna feel this anymore
Pick yourself up off the kitchen floor
What you waitin' for?
[Chorus 1]
Girl, won't you stop your cryin'?
I know that you're tryin'
Everything's gonna be okay
Baby girl, don't you hang your head low
Don't you lose your halo
Everyone's gonna be okay
Baby girl

[Verse 2]
Draw your comparisons, tryin' to find who's lesser than
I don't wanna wear your crown, there's enough to go around

[Pre-Chorus 2]
What you feel is natural (Natural)
You don't gotta put up with this anymore (Anymore)
Pick yourself up off the kitchen floor (Oh)
Tell me what you waitin' for?

[Chorus 1]
Girl, won't you stop your cryin'?
I know that you're tryin'
Everything's gonna be okay
Baby girl, don't you hang your head low
Don't you lose your halo
Everyone's gonna be okay
Baby girl
See Maren Morris LiveGet tickets as low as $69You might also like[Bridge]
Girl, don't hang your head low
Don't lose your halo, don't lose your halo
Girl, don't hang your head low
Don't lose your halo, oh

[Chorus 2]
Girl, won't you stop your cryin'?
I know that you're tryin'
Everything's gonna be okay
Baby girl, don't you hang your head low
Don't you lose your halo
Everyone's gonna be okay
Baby girl, won't you stop your cryin'? (Won't you stop your cryin'?)
I know that you're tryin'
Everything's gonna be okay (Everything's gonna be okay)
Baby girl, don't you hang your head low
Don't you lose your halo
Everyone's gonna be okay (Everyone's gonna be okay)
Baby girl

[Outro]
Everyone's gonna be okay, baby
Mm mm mm, mm mm mm
Hoo hoo hoo, hoo5Embed",GIRL,F,N
Maren Morris,"Rich Lyrics[Intro]
La-a-a-a-a-di-da
La-a-a-a-a-di-da

[Verse 1]
If I had a dollar every time that I swore you off
And a twenty every time that i picked up when you called
And a crisp new Benjamin for when you're here then gone again
And a dollar every time I was right about you after all

[Pre-Chorus]
Boy, I'd be rich, head to toe Prada
Benz in the driveway, yacht in the water
Vegas at the Mandarin, high roller gambling
Me and Diddy drippin' diamonds like Marilyn
No, I wouldn't be drowning in all your IOUs
Every promise you made me would have some real value
'Cause all the little lies rolling off your lips
Is money falling from the sky...
[Chorus]
(Ka-ching, ka-ching)
Shit, I'd be rich
La-a-a-a-a-di-da
I'd be rich
La-a-a-a-a-di-da

[Verse 2]
If I had a dime every time that you crossed my mind
Well, I'd basically be sitting on a big ass pile of dimes
And all the times that you make my heart feel cheap
I might as well have won the lottery
All of this pain and me cursing your name
Would just turn into dollar signs

[Pre-Chorus]
'Cause I'd be rich, head to toe Prada
Benz in the driveway, yacht in the water
Vegas at the Mandarin, high roller gambling
Me and Diddy drippin' diamonds like Marilyn
No, I wouldn't be drowning in all your IOUs
Every promise you made me would have some real value
'Cause all the little lies rolling off your lips
Is money falling from the sky...

[Chorus]
(Ka-ching, ka-ching)
Shit, I'd be rich
La-a-a-a-a-di-da
I'd be rich
La-a-a-a-a-di-da
See Maren Morris LiveGet tickets as low as $69You might also like[Transition]
Told myself I wouldn't do this again
But how much you wanna bet I'mma do this again?

[Pre-Chorus]
Rich, head to toe Prada
Benz in the driveway, yacht in the water
Vegas at the Mandarin, high roller gambling
Me and Diddy drippin' diamonds like Marilyn
No, I wouldn't be drowning in all your IOUs
Every promise you made me would have some real value
'Cause all the little lies rolling off your lips
Is money falling from the sky...

[Chorus]
(Ka-ching, ka-ching)
Shit, I'd be rich
La-a-a-a-a-di-da
I'd be rich
La-a-a-a-a-di-da
I'd be rich
La-a-a-a-a-di-da
I'd be rich
La-a-a-a-a-di-da3Embed",Rich,F,N
Maren Morris,"I Could Use a Love Song Lyrics[Verse 1]
Usually a drink will do the trick
Take the edge off quick, sittin' in the dark
With a shared cigarette
Seeing eye-to-eye and heart-to-heart
But maybe I'm just gettin' old
Used to work, but now it don't

[Verse 2]
A long gone drive
You know the kind where you take a turn
And you don't know why
But it clears your mind, a surefire cure
I need somethin' stronger
That'll last a little longer
[Chorus]
I could use a love song
That takes me back, just like that
When it comes on
To a time when I wouldn't roll my eyes
At a guy and a girl
Who make it work in a world
That for me so far just seems to go so wrong
Yeah, I could use, I could use a love song

[Verse 3]
I wish I didn't know so much
I peeked behind the curtain
Now that magic rush
Feels like a trick that isn't workin'
But I haven't lost all hope yet
Yeah, it's hurtin', but it ain't dead

[Chorus]
I could use a love song
That takes me back, just like that
When it comes on
To a time when I wouldn't roll my eyes
At a guy and a girl
Who make it work in a world
That for me so far just seems to go so wrong
Yeah, I could use, I could use a love song
See Maren Morris LiveGet tickets as low as $69You might also like[Bridge]
Give me a sign or a rhyme or a reason
Just somethin' that I can believe in

[Chorus]
I could use a love song
That takes me back, just like that
When it comes on
To a time when I wouldn't roll my eyes
At a guy and a girl
Who make it work in a world
That for me so far just seems to go so wrong
Yeah, I could use
Yeah, I could use, I could use a love song3Embed",I Could Use A Love Song,F,N
Cole Swindell / Lainey Wilson,"Never Say Never Lyrics[Verse 1: Lainey Wilson, Cole Swindell, Both/Cole Swindell & Lainey Wilson]
I told my momma, I told my friends when it comes to her
When it comes to him, never again
Last time was the last time that time, nearly did us in
Yeah, too much drama
Girl, you're a match, you're gasoline
We just burn too fast
So here we are, lightin' up that spark
Yeah, we tried to run but we didn't get far

[Chorus: Cole Swindell & Lainey Wilson]
I never say never with you, I end up together with you
It's Hell and it's Heaven with you, baby
Anything's possible, the highs are unstoppable
It's so uncontrollable, it's crazy
We say we won't and then we do
You're all I want, I never say never with you
[Verse 2: Cole Swindell, Lainey Wilson, Both/Cole Swindell & Lainey Wilson]
You got a touch that kills me, makes me feel alive
Couldn't turn me off, yeah, even if you tried
So keep turnin' me on and turn out the lights
Who knows tonight, we might get it right

[Chorus: Cole Swindell & Lainey Wilson, Lainey Wilson]
I never say never with you, I end up together with you
It's Hell and it's Heaven with you, baby
Anything's possible, the highs are unstoppable
It's so uncontrollable, it's crazy
We say we won't and then we do
You're all I want, I never say never with you, yeah
I never say never with you

[Instrumental Break]

[Chorus: Cole Swindell, Lainey Wilson, Both/Cole Swindell & Lainey Wilson]
I never say never with you, I end up together with you
It's Hell and it's Heaven with you, baby
Anything's possible, the highs are unstoppable
It's so uncontrollable, it's crazy
We say we won't and then we do
You're all I want, I never say never with you, yeah
We say we won't, but what's the use?
Baby, come on, I'll never say never with you
Oh, no
You're all I want, I never say never with you
Oh, no, no-no, no-no
You might also like[Outro: Lainey Wilson, Cole Swindell, Both/Cole Swindell & Lainey Wilson]
I told my momma, I told my friends when it comes to her
When it comes to him, never againEmbed",Never Say Never,M,N
Jon Pardi,"Last Night Lonely Lyrics[Verse 1]
Yeah, this could be your last drink from a stranger in a bar
The last time that you're dancing in unfamiliar arms
Yeah, this could be your last first kiss, if we do this thing right
Your last time alone beneath neon lights

[Chorus]
It could be your last night coming in here, drinking all by yourself
The last time giving your heart away to someone else
Yeah, we could be some history in the making girl, tonight
Might be your last night lonely
[Verse 2]
Yeah, you could be the last first name that's ever been worth asking
Yeah, you could be the last phone number I write down on a napkin
Yeah, you could be the last girl that I take back home to Mama
The last time that we're talked about in this small-town drama

[Chorus]
It's gonna be the last night coming in here, drinking all by yourself
The last time giving your heart away to someone else
Yeah, we could be some history in the making girl, tonight
Might be your last night lonely
It could be your last night lonely

[Verse 3]
It could be your last night coming in here, drinking all by yourself
The last time giving your heart away to someone else
Yeah, we could be some history in the making girl, tonight
Might be your last night lonely

[Chorus]
It could be your last night coming in here, drinking all by yourself
The last time giving your heart away to someone else
Yeah, we could be some history in the making girl, tonight
Might be your last night lonely
It could be your last night lonely, yeah
Last night lonely, babySee Jon Pardi LiveGet tickets as low as $46You might also likeEmbed",Last Night Lonely,M,N
Jon Pardi,"Tequila Little Time Lyrics[Verse 1]
Pardon me, I don't mean to pry
I saw the tears falling from your eyes, and I thought
You're too pretty not to wear a smile
Hope you don't mind if I sit down for awhile

[Chorus]
'Cause I want tequila little time with you
A little salt and a lime will do
Hey bar man, will you bring us two?
I want tequila little time with you
Talkin' it all out
Seein' what you're all about
I hope you're wantin' tequila little time with me too
[Verse 2]
We don't have to talk about the past
Here's to moving forward and not looking back
Little later, we can take it to the dance floor
But until then, let's order a couple more

[Chorus]
'Cause I want tequila little time with you
A little salt and a lime will do
Hey bar man, will you bring us two?
I want tequila little time with you
Talkin' it all out
Seein' what you're all about
I hope you're wantin' tequila little time with me too

[Bridge]
It's good to see you laughin'
I guess this had to happen
Now let's just get to dancin'

[Chorus]
'Cause I want tequila little time with you
A little salt and a lime will do
Hey bar man, will you bring us two?
I want tequila little time with you
Talkin' it all out
Seein' what you're all about
I hope you're wantin' tequila little time with me too
See Jon Pardi LiveGet tickets as low as $46You might also like[Outro]
Hope you're wantin' tequila little time with me too
Hope you're wantin' tequila little time with me too, oh2Embed",Tequila Little Time,M,N
Jon Pardi,"Ain’t Always the Cowboy Lyrics[Verse 1]
Her hands wrapped up in mine
Tears rollin' out of her eyes
No messin' with a made-up mind
Sun settin' on goodbye
Yeah, it's hard to believe
It wasn't me tryin' to leave this time

[Chorus]
It ain't always the cowboy
That ain't got a lot of hang around
Ain't got no settle down in their boots
Gone's just what they do
That restless running, searchin' for something
Leavin' love in the dust of a midnight Chevrolet
It ain't always the cowboy that rides away
[Verse 2]
I've never seen over from this side
Never heard lonely get this quiet
Still, I can't keep from smiling
'Cause, damn, that girl can fly

[Chorus]
It ain't always the cowboy
That ain't got a lot of hang around
Ain't got no settle down in their boots
Gone's just what they do
That restless running, searchin' for something
Leavin' love in the dust of a midnight Chevrolet
It ain't always the cowboy that rides away

[Bridge]
A tumbleweed heart chasin' that wind
Goin' too far, wherever that is

[Chorus]
It ain't always the cowboy
That ain't got a lot of hang around
Ain't got no settle down in their boots
Gone's just what they do
That restless running, searchin' for something
Leavin' love in the dust of a midnight Chevrolet
It ain't always the cowboy that rides away
Rides away
It ain't always the cowboySee Jon Pardi LiveGet tickets as low as $46You might also like3Embed",Ain't Always The Cowboy,M,N
Jon Pardi,"Heartache Medication Lyrics[Verse 1]
Same old dive, same old end of the work week drink
Bartender knows my name, but I don't mind
She kicks 'em up strong, serves me up right

[Chorus]
And here I go again, I'm drinkin' one, I'm drinkin' two
I got my heartache medication, a strong dedication
To gettin' over you, turnin' me loose
On that hardwood jukebox lost in neon time
My heartache medication, well, it suits me fine
And I'm drinkin' enough to take you off my mind
I got my heartache medication
[Verse 2]
Another girl, another dance to a country song
Turnin' me on, here's to a good time
And halfway to feelin' alright

[Chorus]
And here I go again, I'm drinkin' one, I'm drinkin' two
I got my heartache medication, a strong dedication
To gettin' over you, turnin' me loose
On that hardwood jukebox lost in neon time
My heartache medication, well it suits me fine
And I'm drinkin' enough to take you off my mind
I got my heartache medication

[Bridge]
Single, drinkin' doubles
Teardrops turnin' into bubbles
Yeah, a little later on
I'll probably find me some trouble

[Chorus]
And here I go again, I'm drinkin' one, I'm drinkin' two
I got my heartache medication, a strong dedication
To gettin' over you, turnin' me loose
On that hardwood jukebox lost in neon time
My heartache medication, well it suits me fine
And I'm drinkin' enough to take you off my mind
I got my heartache medication
See Jon Pardi LiveGet tickets as low as $46You might also like[Outro]
Heartache medication takin' me away
Oh whoaEmbed",Heartache Medication,M,N
Jon Pardi,"Night Shift Lyrics[Verse 1]
It's been a wreck me week
Sixty plus from dawn to dusk
In the red dirt heat
Busting it up for a couple of bucks
But it ain't no thing
Just another day 'til I'm on my way
To them cool, cool sheets and you and me

[Chorus]
Working on the night shift, baby
Dying for your touch like crazy
Racking up the overtime hours
Loving how we're working on the night shift, baby
[Verse 2]
Gonna rock it right
No need to talk, I know what you want
And what you like
'Cause I do too, yeah
I love how you leave on the lights
Not a thing between you and me
And it feels so nice when you and I are

[Chorus]
Working on the night shift, baby
Dying for your touch like crazy
Racking up the overtime hours
Loving how we're working on the night shift, baby

[Bridge]
Yeah, yeah
It's been a wreck me week
Oh, but who needs sleep?

[Chorus]
When you're working on the night shift, baby
Dying for your touch like crazy
Racking up the overtime hours
Loving how we're working on the night shift, baby
Loving how we're working on the night shift
Loving how we're working on the night shift
Working on the night shift, babySee Jon Pardi LiveGet tickets as low as $46You might also like1Embed",Night Shift,M,N
Jon Pardi,"She Ain’t In It Lyrics[Verse 1]
Appreciate your call
Means a lot and all
Yeah, I got a minute
You and me can talk
About anything you want
As long as she ain't in it

[Verse 2]
Say, it's been at least a month
Since I've had any fun
Buddy, I'll admit it
Yeah, I'm into going out
Think I'm ready for a crowd
As long as she ain't in it
[Chorus]
Don't wanna hear her name
I don't wanna see her face, I swear
I know its gonna hurt
If I run into her somewhere

[Verse 3]
We could hit that place
Down by the interstate
Out past the city limits
Hangout all night long
Hear a country song
As long as she ain't in it

[Chorus]
Don't wanna hear her name
I don't wanna see her face, I swear
I know its gonna hurt
If I run into her somewhere

[Outro]
I can drink and I can dance
I can party, I can laugh
But no matter how you spin it
Everything has changed
My life won't be the same
As long as she ain't in it
As long as she ain't in it, noSee Jon Pardi LiveGet tickets as low as $46You might also likeEmbed",She Ain't In It,M,N
"Dierks Bentley, BRELAND & HARDY","Beers On Me Lyrics[Verse 1: Dierks Bentley, Dierks Bentley & BRELAND]
Everybody's got a problem, so do I
But we ain't gonna solve 'em on a Saturday night
I just put a paycheck in the bank
And I ain't hit the town in a minute to drink
You had one of them, one of those weeks
Stuck on repeat, I'll save you a seat

[Chorus: Dierks Bentley]
Come on down, swing on by
Bring whatever's been on your mind
Locals on tap and bottles on ice
Livin' on feel-good standard time
My card's on the bar, you've got nowhere to be
If you don't come through, buddy, that's on you
'Cause the beer's on me, yeah, the beer's on me (Ain't that right, Hardy?)
[Verse 2: Hardy, Hardy & BRELAND]
Yeah, I'ma get a round or two for all I want
Just a-bustin' your back while you're cussin' the sun
And if your girl don't love you no more
Wеll, here's a tall boy to cry in and it's been paid for
And if you're short on cash, say, ""Cheers""
Don't swеat it, leave the sweatin' to the beer and

[Chorus: Dierks Bentley]
Come on down, swing on by
Bring whatever's been on your mind
Locals on tap and bottles on ice
Livin' on feel-good standard time
My card's on the bar, you've got nowhere to be
If you don't come through, buddy, that's on you
'Cause the beer's on me, yeah, the beer's on me

[Verse 3: BRELAND & Dierks Bentley]
Oh-oh, oh-oh, oh-oh, mm (Drink it down)
I like my drinks like my roof, on the house
We turnin' up, got double cups, the sun's goin' down (Woo, ooh)
With lagers, I'm a boxer, yeah, I need 'bout twelve rounds
And I could be your sponsor if you like how that sounds
Tell me what you're drinkin', buckets for a Lincoln
I could cover you and me and everyone you're bringin'
See Dierks Bentley LiveGet tickets as low as $74You might also like[Chorus: Dierks Bentley & BRELAND]
Come on down, swing on by
Bring whatever's been on your mind
Locals on tap and bottles on ice
Livin' on feel-good standard time
My card's on the bar, you've got nowhere to be
If you don't come through, buddy, that's on you
'Cause the beer's on me, yeah, the beer's on me
The beer's on me, gonna save you a seat (Oh-oh, oh-oh)
'Cause the beer's on me

[Outro: Dierks Bentley]
Come get a Bud heavy, Busch Light
Kill a cold Miller, Blue Moon, Red Stripe
Naturday don't matter to me
'Cause don't nothin' taste better than free
Yeah, the beer's on me1Embed",Beers On Me,M,N
ERNEST Featuring Morgan Wallen,"Flower Shops Lyrics[Verse 1: ERNEST]
It's a beautiful day, she's been crying all night
Ah, there's tears in her blue, bloodshot in mine
This bender's been bending, it's hellbound to break
My baby's had all she can take

[Chorus: ERNEST]
Mister, I'll take your roses
If you cut off the thorns, she can't take no more
I'll buy violets and daisies to hide all the crazy
It's gonna take all you've got
Ah, it's a bad day for love
But a good day for flower shops
[Verse 2: Morgan Wallen]
Well, I took some pills and she took the dogs
Ah, it's all gone to hell, she's gone to her mom's
And I took up drinkin' since she took the time
To tell me I took the best years of her life

[Chorus: Morgan Wallen]
So buddy, I'll take your roses
If you cut off the thorns, she can't take no more
I'll buy violets and daisies to hide all the crazy
It's gonna take all you got
It's a tough day for love
But a good day for flower shops

[Bridge: ERNEST and ERNEST & Morgan Wallen]
Roses are red, violets are blue
I don't need one, I need one million to get you

[Chorus: ERNEST, Morgan Wallen, Both]
So mister, I'll take your roses
If you cut off the thorns, she can't take no more
I'll buy violets and daisies to get back my baby
It's gonna take all you've got
Ah, it's a bad day for love
But a good day for flower shopsYou might also like5Embed",Flower Shops,M,N
Thomas Rhett,"Slow Down Summer Lyrics[Verse 1]
Your shades on my dashboard, shoes on my floorboard
Lived in that old Chevrolet
We were two Roman candles, too hot to handle
Two hearts that couldn't be tamed

[Pre-Chorus]
Yeah, we knew what was comin’
And laughed it off like it was nothin'
Oh, but time kept on runnin' and runnin’ away
[Chorus]
Yeah, what can I say?
We had our hopes up and the windows down
Fallin' fast in a one-lane town
Tangled up with your lips on mine
Never seen a brighter green in those eyes and
I put my jacket on your shoulder
Wishin' the weather wasn't gettin' colder
Lettin' you go, holdin' onto each other
Closin' our eyes, sayin’, ""Slow down, summer""
(Slow down, summer)

[Verse 2]
I was beggin’ those leaves, ""Don't go changin’ on me""
""Friday night lights, stay away""
But the Fourth of July was just smoke in the sky
And our sunburns were startin' to fade

[Pre-Chorus]
Yeah, we knew what was comin'
And laughed it off like it was nothin'
Oh, but time kept on runnin’ and runnin' away

[Chorus]
Yeah, those were the days
We had our hopes up and the windows down
Fallin' fast in a one-lane town
Tangled up with your lips on mine
Never seen a brighter green in those eyes and
I put my jacket on your shoulder
Wishin' the weather wasn't gettin' colder
Lettin' you go, holdin' onto each other
Closin' our eyes, sayin', ""Slow down, summer""
(Slow down, summer)
See Thomas Rhett LiveGet tickets as low as $8You might also like[Bridge]
Why couldn't you slow down, summer?
Just wait a minute, we weren't finished
Can we just hold onto each other?
Take me back to the beginnin', oh
Slow down, summer
Slow down, summer

[Chorus]
Yeah, those were the days
We had our hopes up and the windows down
Fallin' fast in a one-lane town
Tangled up with your lips on mine
Never seen a brighter green in those eyes and
I put my jacket on your shoulder
Wishin' the weather wasn't gettin' colder
Lettin' you go, holdin' onto each other
Closin' our eyes, sayin', ""Slow down, summer""

[Outro]
Oh (Slow down, summer)
Slow down, summer, yeah
Why couldn't you slow down, summer?
Why couldn't you slow down?
Slow down
Why couldn't you slow down, summer?1Embed",Slow Down Summer,M,N
Thomas Rhett,"What’s Your Country Song Lyrics[Verse 1]
Did you grow up on a tractor?
Did your daddy let you drive?
Are you whiskey bent and hell bound?
Even though your mama tried
Did you cruise down a backroad
With your Dixieland Delight?
Are you on the Chattahoochee
On a barefoot blue jean night?

[Chorus]
Everybody got a small town anthem
Everybody got a story to tell
Everybody got a hallelujah
Everybody been through a little hell
When you're rolling down a two-lane highway
And you turn your radio on
Tell me which one hits you, baby
Yeah, what's your country song?
Yeah, what's your country song?
[Verse 2]
Do your exes live in Texas?
Are you so lonesome you could cry?
Are you heart-broke 'cause you know
That ain't your truck in her drive?
Are your friends all in low places
Underneath the neon moon?
Were you already country
Back when country wasn't cool?

[Chorus]
Everybody got a small town anthem
Everybody got a story to tell
Everybody got a hallelujah
Everybody been through a little hell
When you're rolling down a two-lane highway
And you turn your radio on
Tell me which one hits you, baby
Yeah, what's your country song?
Yeah, what's your country song?

[Bridge]
Who's your strawberry wine?
What's your family tradition?
What makes you turn it up?
Makes you raise your cup every time you listen?
See Thomas Rhett LiveGet tickets as low as $8You might also like[Chorus]
Everybody got a small town anthem
Everybody got a story to tell
Everybody got a hallelujah
Everybody been through a little hell
When you're rolling down a two-lane highway
And you turn your radio on
Tell me which one hits you, baby
Yeah, what's your country song?
Yeah, what's your country song?2Embed",What's Your Country Song,M,N
Thomas Rhett,"Country Again Lyrics[Verse 1]
I quit huntin' with my daddy, guess I didn't make the time
And it's been a year since I've seen a deer, had a smallmouth on the line
The other day I hooked a monster, and as I reeled him in
I thought, ""Man, it feels good to be country again""

[Verse 2]
I spent way less time in Nashville, more time in L.A
My back home buddies, they quit callin', thought I had too much on my plate
But last night, we cracked some cold beers and cranked Eric Church to ten
Thought, ""Man, it feels good to be country again""
[Chorus]
Yeah, I love me some California, but it sure ain't Tennessee
And my roots down there in Georgia, yeah, they started missin' me
And I wouldn't change the things I've done or the places that I've been
Man, it feels good to be country again

[Verse 3]
I traded in my Silverado, didn't need no four-by-four
I tucked my boots in the back of the closet, they didn't feel like me no more
But I dug 'em out and slipped 'em on, they've been on my feet since then
Man, it feels good to be country again

[Bridge]
Oh-oh

[Chorus]
Yeah, I love me some California, but it sure ain't Tennessee
And my roots down there in Georgia, yeah, they started missin' me
And I wouldn't change the things I've done or the places that I've been
Man, it feels good to be country again

[Verse 4]
I traded sunsets with my wife, for hours on my phone
And even when I was right beside her, I still wasn't really home
But last night, we built a fire, watched the moonlight kiss her skin
I thought, ""Man, it feels good to be country again""
""Man, it feels good to be country again""
See Thomas Rhett LiveGet tickets as low as $8You might also like[Outro]
Ooh
I saw the light, I found the way home
Thank you Lord, Amen
Man, it feels good to be country againEmbed",Country Again,M,N
