artist,lyrics,song_name,gender,POC
Michael Ray,"One That Got Away Lyrics[Intro]
Yeah, yeah, yeah (Ha, ha)
Yeah, yeah, yeah

[Verse 1]
She's like a picture from an airplane window
It's always sunny up above the clouds
She's got a mouth full of innuendo
But she makes it sound innocent somehow
Those hungry eyes can't be denied
Take me to church, show me the light
Straight masterpiece, way out of my league
Yeah but I'm gonna hold her like a trophy tonight
[Chorus]
She's decoratin' my car
Soon she'll be breakin' my heart
She's too Wild Horses to be all mine
I'll be your Beast of Burden on borrowed time
She's gonna rip off any kind of label
She's into leavin' those strings untied
Keepin' it tax free, under the table
She might only be mine tonight
But that's alright, that's okay
She's gonna be one hell of a one that got away
That's alright, might hurt, but hey
She's gonna be one hell of a one that got away

[Verse 2]
Yeah, yeah, yeah
Yeah, yeah, yeah
I ain't gonna sit here and overthink it
I got a tiger by the tail
I'll just smile when she sinks her teeth in
She'll leave a scar and a story to tell

[Chorus]
She's decoratin' my car
Soon she'll be breakin' my heart
She's too Wild Horses to be all mine
I'll be your Beast of Burden on borrowed time
She's gonna rip off any kind of label
She's into leavin' those strings untied
Keepin' it tax free, under the table
She might only be mine tonight
But that's alright, that's okay
She's gonna be one hell of a one that got away
That's alright, might hurt, but hey
She's gonna be one hell of a one that got away
You might also like[Bridge]
Hey hey, hey hey
She's gonna sting me but damn it I want it
Hey hey, hey hey
Honey's so sweet in that moment

[Chorus]
She's decoratin' my car
Soon she'll be breakin' my heart
She's too Wild Horses to be all mine
I'll be your Beast of Burden on borrowed time
She's gonna rip off any kind of label
She's into leavin' those strings untied
Keepin' it tax free, under the table
She might only be mine tonight
But that's alright, that's okay
She's gonna be one hell of a one that got away
That's alright, might hurt, but hey
She's gonna be one hell of a one that got away

[Outro]
Yeah, yeah, yeah
Yeah, yeah, yeah
She's gonna be one hell of a one that got away
Hey hey, yeah
Hey hey, yeah
Hey hey, yeah
Hey hey, yeah, yeahEmbed",One That Got Away,M,N
Michael Ray,"Get to You Lyrics[Verse 1]
Somebody had to hurt you bad
For you to give up like that
Somebody had to break your heart in two
But that ain't me and you
So tell me why, tell me why, tell me why
You can't look me in the eye
What am I supposed to do?
When you say we're through
Why do you?
[Chorus]
Run away, run away from love
What the hell are you so scared of?
You walk away when you've had enough
Of trying, of trying
Girl there's always gonna be some pain
A little sunshine, a little rain
It doesn't mean it ain't worth it babe
I'm trying, I'm trying to get to you
To you

[Verse 2]
One day you're gonna love again
Mess up and let somebody in
To every part of your whole world
You think it's unthinkable girl
But somebody's gonna break those walls
Somebody's gonna watch you fall
Gonna give it your all and I hope that I'm around
When you finally find out why you

[Chorus]
Run away, run away from love
What the hell are you so scared of?
You walk away when you've had enough
Of trying, of trying
Girl there's always gonna be some pain
A little sunshine, a little rain
It doesn't mean it ain't worth it babe
I'm trying, I'm trying to get to you
To you
You might also like[Bridge]
So tell me why, tell me why, tell me why
You can't look me in the eye
What am I supposed to do?
When you say we're through
Why do you?

[Chorus]
Run away, run away from love
What the hell are you so scared of?
You walk away when you've had enough
Of trying, of trying
Girl there's always gonna be some pain
A little sunshine, a little rain
It doesn't mean it ain't worth it babe
I'm trying, I'm trying to get to you
To you

[Outro]
Somebody had to hurt you bad
For you to give up like that
Somebody had to break your heart in two
But that ain't me and youEmbed",Get To You,M,N
Kelsea Ballerini,"HEARTFIRST Lyrics[Verse 1]
Met him at a party
Accidentally brushed his body
On the way to get a drink at the bar
I couldn't wait 'til later
Talking in the elevator
Then we're kissing in the back of the car

[Pre-Chorus]
That voice in my head says to slow down
But it can't see the way you lookin' at me right now
It may not be next week what I need
Then again, maybe it might be
[Chorus]
Could be forever or we might break
That's just the kind of risk that we take
My head is yellin' that I could get hurt
But I'm gonna jump right in, baby, with my heart first

[Post-Chorus]
I gotta have it
Gotta see if this works
I gotta have it
Wake up in your t-shirt

[Verse 2]
Who knows what'll happen
Ain't it always kinda magic
When you don't know who's holding the cards? (Ah-ah)
Could bе a wish I never knew ya
Or pеrmanently tattooed ya
Only the moon knows what's in the stars (What's in the stars)

[Pre-Chorus]
Mmm, that voice in my head says to slow down
But it can't feel your hands on my hips right now
It may not be next year what I need
Then again, maybe it might be
You might also like[Chorus]
Could be forever or we might break
That's just the kind of risk that we take
My head is yellin' that I could get hurt
But I'm gonna jump right in, baby, with my heart first

[Post-Chorus]
I gotta have it
Gotta see if this works (I gotta have it)
I gotta have it
Wake up in your t-shirt
I gotta have it
Diving in heart first (Diving in heart first)
I gotta have it
Ooh, I gotta have ya

[Bridge]
And I can't even stop myself anymore
(Ooh, I gotta have it, yeah-yeah)
Oh, it could be the perfect night outside my front door

[Chorus]
Could be forever or we might break
That's just the kind of risk that we take
My head is yellin' that I could get hurt
But I'm gonna jump right in, baby, with my heart first
[Post-Chorus]
I gotta have it
Gotta see if this works (I gotta have it)
I gotta have it
Wake up in your t-shirt (Wake up in your t-shirt, yeah)
I gotta have it
Diving in heart first (Diving in heart first)
I gotta have it
Yeah, I gotta have ya2Embed",Heartfirst,F,N
Kelsea Ballerini,"​hole in the bottle Lyrics[Intro]
There are many people who drink in moderation with no problems
Social, moral, or medical
They have learned to enjoy liquor without letting it upset
The functioning of their body and mind
It relaxes you, makes you more congenial (I just had one sip)
This helps make a gathering cheerful and friendly

[Verse 1]
It ain't my fault, so don't blame me
I swear I just came here to unwind and have one drink
The way it looks, it ain't what you think
This Cabernet has a way of vanishing on me
[Chorus]
There's a hole in the bottle leaking all this wine
It's already empty and it ain't even supper time
Honey, no, I don't miss him
In fact, it slipped my mind
There's a hole in the bottle of wine

[Verse 2]
I keep my cool, play by all the rules
I swear ten minutes ago that bottle was full
But I won't cry about love gone wrong
'Cause tears would water down this ruby red I'm sipping on

[Chorus]
There's a hole in the bottle leaking all this wine
It's already empty and it ain't even supper time
Honey, no, I don't miss him
In fact, it slipped my mind
There's a hole in the bottle of wine (Aw, yeah)

[Bridge]
I went and got a new one
'Cause the other one was broken
Now this one's halfway gone
And it's barely even open
You might also like[Chorus]
There's a hole in the bottle (Hole in the bottle) leaking all this wine
It's already empty and it ain't even supper time
Honey, no, I don't miss him
In fact, it slipped my mind
There's a hole in the bottle of wine

[Outro]
You may ask me where it's going
But I can't even find
The hole in the bottle of wine
She has abused her system, and she's paying for it1Embed",Hole In The Bottle,F,N
Kelsea Ballerini,"​homecoming queen? Lyrics[Verse 1]
Hey, homecoming queen
Why do you lie?
When somebody's mean
Where do you hide?
Do people assume
You're always alright?
Been so good at smiling
Most of your life

[Pre-Chorus]
Look damn good in the dress
Zipping up the mess
Dancing with your best foot forward
Does it get hard
To have to play the part?
Nobody's feeling sorry for ya
[Chorus]
But what if I told you the world wouldn't end
If you started showing what's under your skin?
What if you let 'em all in on the lie?
Even the homecoming queen cries
Oh

[Verse 2]
Hey, homecoming queen
How's things at home?
Still walking on eggshells
When that curtain's closed?
Did your Daddy teach you
How to act tough?
Or more like your Mama
Sweep it under the rug?

[Pre-Chorus]
Look damn good in the dress
Zipping up the mess
Dancing with your best foot forward
Did you want the crown?
Or does it weigh you down?
Nobody's feeling sorry for ya

[Chorus]
What if I told you the world wouldn't end
If you started showing what's under your skin?
What if you let 'em all in on the lie?
Even the homecoming queen cries
Yeah, what if I told you the sky wouldn't fall?
If you lost your composure, said to hell with it all
Not everything pretty sparkles and shines
And even the homecoming queen cries (Ooh)
Oh yeah (Ooh)
Even the homecoming queen cries (Ooh)
Mmm-mmm, mmm (Ooh)
You might also like[Outro]
Hey, homecoming queen
Why do you lie?
When somebody's mean
Where do you hide?2Embed",homecoming queen?,F,N
Kelsea Ballerini,"Miss Me More Lyrics[Verse 1]
I retired my red lipstick 'cause you said you didn't like it
I didn't wear my high heel shoes
'Cause I couldn't be taller than you
I didn't wanna lose my friends, but now it's hard to even find them
It's what you wanted, ain't it?
It's what you wanted

[Pre-Chorus]
I thought I'd miss you (When it ended)
I thought it hurt me (But it didn't)
I thought I'd miss you
I thought I'd miss you
[Chorus]
But I miss me more
I miss my own beat, to my own snare drum
I miss me more
Miss my own sheets in the bed I made up
I forgot I had dreams, I forgot I had wings
Forgot who I was before I ever kissed you
Yeah, I thought I'd miss you
But I miss me more (I miss me more)

[Verse 2]
I put on my old records that I hid in the back of the closet
And I turn them up to ten
And then I played them all again
I found my independence
Can't believe I ever lost it
What you wanted, ain't it?
It's what you wanted

[Pre-Chorus]
I thought I'd miss you (When it ended)
I thought it hurt me (But it didn't)
I thought I'd miss you
Yeah, I thought I'd miss you

[Chorus]
But I miss me more
I miss my own beat, to my own snare drum
(I miss me more)
Miss my own sheets in the bed I made up
I forgot I had dreams, I forgot I had wings
Forgot who I was before I ever kissed you
Yeah, I thought I'd miss you
But I miss me more (I miss me more)
You might also like[Bridge]
I thought I'd miss you
I thought it hurt me
And I'd wanna kiss you
I thought I'd miss you

[Chorus]
But I miss me more
I miss my own beat, to my own snare drum
(I miss me more)
Miss my own sheets in the bed I made up
I forgot I had dreams, I forgot I had wings
Forgot who I was before I ever kissed you
And I thought I'd miss you
But I miss me more
(I miss me more)
(I miss me more)
(I miss me more)7Embed",Miss Me More,F,N
Kelsea Ballerini,"Legends Lyrics[Verse 1]
We were golden, we were fire, we were magic
Yeah, and they all knew our names all over town
We had it made in the middle of the madness
We were neon in a grey crowd
Yeah, we wrote our own story
Full of blood, sweat, and heartbeats
We didn’t do it for the fame or the glory
But we went down in history

[Chorus]
Yeah, we were legends
Loving you, baby, it was Heaven
What everyone wondered, we’d never question
Close our eyes and took on the world together
Do you remember?
We were crazy
Tragic and epic and so amazing
I’ll always wear the crown that you gave me
We will always stay lost in forever
And they’ll remember
We were legends
[Verse 2]
Like we were written down in permanent marker
Not even the brightest sun could ever fade
Come whichever, Hell or high water
It was always me and you either way
Hey, we wrote our own story
Full of blood, sweat, and heartbeats
We didn’t do it for the fame or the glory
We just did it for you and me

[Chorus]
And that’s why we were legends
Loving you, baby, it was Heaven
What everyone wondered, we’d never question
Close our eyes and took on the world together
Do you remember?
We were crazy
Tragic and epic and so amazing
I’ll always wear the crown that you gave me
We will always stay lost in forever
And they’ll remember
We were legends
Oh, woah

[Chorus]
We were legends
Loving you, baby, it was Heaven
What everyone wondered, we’d never question
Close our eyes and took on the world together
Do you remember baby?
We were crazy
Tragic and epic and so amazing
I'll always wear the crown that you gave me
We will always stay lost in forever
And they’ll remember
We were legends
We were
Yeah, we were legends
Yeah, we wrote our own storyYou might also like5Embed",Legends,F,N
Kelsea Ballerini,"I Hate Love Songs Lyrics[Verse 1]
I hate Shakespeare and Gosling and cakes with white frosting
Two names in a heart-shaped tattoo
I think cupid is stupid and violets are purple not blue
I hate catching bouquets, the honeymoon phase
And letterman jackets don't fit
Your eyes can't hold stars and you'd die if your heart really skipped

[Chorus]
I hate love songs
Yeah, I really do
I hate love songs
But I love you
[Verse 2]
I hate pink hearts with glitter and Valentine's dinner
And roses just die in a week
We were drunk when we met so we don't know our anniversary (Whoops)
Oh, and I'm far too vain to kiss in the rain
The clouds, they aren't numbered to nine
And you make me feel something
But it sure as hell ain't butterflies

[Chorus]
I hate love songs
Yeah, I really do
I hate love songs
But I love you
Yeah

[Interlude]
I really do

[Bridge]
And I'll always love you but I don't have to sing it
""For worse or for better"" don't rhyme
They say I got the right one so now I should write one
But I'd rather just show you tonight

[Chorus]
'Cause I hate love songs
Yeah, I really do
I hate love songs
But I love you
I hate love songs
The old and the new
I hate love songs
But I love youYou might also like4Embed",I Hate Love Songs,F,N
Keith Urban,"Wild Hearts Lyrics[Verse 1]
Saw the man in black, spotlight in the air
Heard a thousand screams, I saw my daddy stare
Feel like I've been runnin' since the day that I was born
Eagle on my back, phoenix on my arm

[Chorus]
This goes out to the drifters
And all of the dreamers ready to fly
All those born to be rockstars
Lifting their guitars and painting the sky
Can you hear me?
All of you lost ones who aren't really lost ones
Keep shining your light
This goes out to the wildcards and all of the wild hearts
Just like mine
[Verse 2]
Now listen
Has anyone ever told you, you'll never amount to anything?
You're just wastin' your time chasin' the tail of a dragon kind of dream
But I'm here to tell you anything can happen in this life
If you got that heart and the passion and a God lit fire inside

[Chorus]
This goes out to the drifters
And all of the dreamers ready to fly
All those born to be rockstars
Lifting their guitars and painting the sky
Can you hear me?
All of you lost ones who aren't really lost ones
Keep shining your light
This goes out to the wildcards and all of the wild hearts
Just like mine (Oh, ha)
Just like mine (Oh, oh)

[Bridge]
This goes out to the drifters
And all of the dreamers ready to fly
All you born to be rockstars
Lifting your guitars and painting the sky, oh

[Chorus]
This goes out to the drifters (Woo)
And all of the dreamers ready to fly (Hey)
All those born to be rockstars
Keep lifting your guitars and painting the sky
(Can you hear me?)Can you hear me? (Oh)
All of you lost ones who aren't really lost ones
Keep shining your light (Keep shining)
See Keith Urban LiveGet tickets as low as $67You might also like[Outro]
This goes out to the wildcards
Who's got the wild heart
Just like mine?1Embed",Wild Hearts,M,N
Keith Urban,"God Whispered Your Name Lyrics[Verse 1]
I was so cold and lost
And nothing seemed to ring true
I couldn't bear the cross
For everything I'd been through
And each day, I knew I needed change
But there was no way, no way

[Chorus]
And then God whispered your name
And that's when everything changed
And love came out of the rain
And talk about being saved
Suddenly I wanna live
More than I ever did
I'm never gonna be the same
When God whispered your name
[Verse 2]
I can see the sunshine
For the first time in a while
Girl, it's like I've been baptized
By the warmth of your smile, hmm
Well, call it fate or faith or call it crazy either way
It's amazin', amazin' grace

[Chorus]
When God whispered your name
That's when everything changed
Love came out of the rain
Talk about being saved
Well, suddenly I wanna live
More than I ever did
I'm never gonna be the same
When God whispered your name

[Bridge]
It's just what I needed to hear, baby
It couldn't have been more loud and clear

[Chorus]
When God whispered your name
That's when everything changed
Love came out of the rain (Out of the rain)
And talk about being saved
Oh, suddenly I wanna live
More than I ever did
I'm never gonna be the same
When God whispered your name, oh yeah
See Keith Urban LiveGet tickets as low as $67You might also like[Outro]
(Hallelujah, Hallelujah, Hallelujah)
Ooh, Hallelujah, baby
(Hallelujah) Oh, yeah, hmm-hmm (Hallelujah)
(Hallelujah) Ooh yeah
I can see the sunlight shinin' through your pretty eyes, baby
(Hallelujah) Woo, hmm (Hallelujah)
I like a man who leaves, time feels like Hell
(Hallelujah) Got my hands up high, I got my hands up to the sky
(Hallelujah) Ooh, I'm sayin' thank you (Hallelujah)
(Hallelujah)
(Hallelujah, Hallelujah)
(Hallelujah)1Embed",God Whispered Your Name,M,N
Keith Urban,"We Were Lyrics[Verse 1]
We were just a couple years short of the age
By my name on a fake ID
And still 'bout a hundred away from the day
Your daddy said you could run with me
We were a couple of line steppers
Who just couldn’t wait to step over the line
Never thinkin' we wouldn't last
I was your first and you were mine

[Chorus]
And we were leather jackets hangin’ onto a Harley
Two heartbeats in the moonlight
We were both feet hangin' out over the edge
Of the water tower skyline
At least there's a little bit of sweet in the bitter
Though a part of me is always gonna miss her
I am who I am, I just miss who I was when we were
Mm-hmm
[Verse 2]
We were gonna make it, weren't we, baby?
Had it all laid out in our mind
By the time we knew time was runnin' out
We'd done run out of time
And we were downtown Saturday night, last-call cover band
'Til the last song played, never thought we'd fade
Like the stamp on the back of her hand

[Chorus]
We were her on my shoulders, lighter in the air
""Pour Some Sugar On Me""
We were a top down at Johnson’s field
When she whispered that she wants me
At least there’s a little bit of sweet in the bitter
Though a part of me is always gonna miss her
I am who I am, I just miss who I was when we were
Oh, mm-hmm

[Chorus]
We were leather jackets hangin' onto a Harley
Two heartbeats in the moonlight
We were both feet hangin’ out over the edge
Of the water tower skyline
At least there's a little bit of sweet in the bitter
Though a part of me is always gonna miss her
I am who I am, I just miss who I was when we were
Mmm, yes, I do
See Keith Urban LiveGet tickets as low as $67You might also like[Outro]
My friends say
""Oh well, let that ship sail
You gotta let go of her""
Just wasn't meant to be
But somewhere down deep, I still believe
That we wereEmbed",We Were,M,N
Keith Urban,"Never Comin Down Lyrics[Verse 1]
I can feel it coming on now
As the music plays
Taking shots with the night owls
As the world just fades away
Got a paycheck in my pocket
'Bout to get it all gone
Light it up like a rocket
We're going all night long

[Pre-Chorus]
Everybody sing ooh, mmm
I love it when you ooh
[Chorus]
When the sun goes down, stars come out
It's a, can you feel it?
When I take you by the hand, dancin’
And we pass it around, ‘round, ‘round
Yeah, we're so high, we could paint the sky
Tear the top right off the ceiling
And I swear we're never, ever coming down
Never coming down

[Post-Chorus]
Oh, oh, ooh yeah
Tell me now, can you feel it?
Oh, oh
Never, ever, never coming down

[Verse 2]
Well, the band's on fire
And the beer is ice cold
We're going down to the wire
Then we'll all go rolling home
And maybe we'll keep it going
'Til we see that sun
Coming up right here, right now
I wanna see you move and hear you sing it out loud
Ooh
See Keith Urban LiveGet tickets as low as $67You might also like[Chorus]
When the sun goes down, stars come out
It's a, can you feel it?
When I take you by the hand, dancin’
And we pass it around, ‘round, ‘round
Yeah, we're so high, we could paint the sky
Tear the top right off the ceiling
And I swear we're never, ever coming down
Never coming down

[Post-Chorus]
Oh, oh, ooh yeah
Tell me now, can you feel it?
Oh, oh
Never, ever, never coming down
Oh, oh, ooh yeah
Tell me now, can you feel it?
Oh, oh
Never coming down

[Bridge]
Dance, baby, dance, baby
Don't stop now
Dance, baby, dance, baby
Don't stop now
I said oh now, oh now, oh now, oh now
Dance, baby, dance, baby
I said oh now, oh now, oh now, oh now
Wait a minute, baby, tell me one more time
She said now, oh now, oh now, oh now, oh now
Dance, baby, dance, baby
Oh now, oh now, oh now, oh now
[Chorus]
When the sun goes down, stars come out
It's a, can you feel it?
When I take you by the hand, dancin’
And we pass it around, ‘round, ‘round
Yeah, we're so high, we could paint the sky
With the love right now, we feel it
And I swear we're never, ever coming down
Never coming down
Never coming down

[Post-Chorus]
Oh, oh, ooh yeah
Tell me now, can you feel it?
Oh, oh
Never coming down
Oh, oh, ooh yeah
Tell me now, can you feel it?
Oh, oh
Never coming downEmbed",Never Comin Down,M,N
Keith Urban,"Female Lyrics[Verse 1]
When you hear somebody say somebody hits like a girl
How does that hit you?
Is that such a bad thing?
When you hear a song that they play sayin' you run the world
Do you believe it?
Will you live to see it?

[Chorus]
Sister, shoulder
Daughter, lover
Healer, broken halo
Mother nature
Fire, suit of armor
Soul survivor, Holy Water
Secret keeper, fortune teller
Virgin Mary, scarlet letter
Technicolor, river wild
Baby, girl, woman, child
Female
[Verse 2]
When somebody laughs and implies that she asked for it
Just cause she was wearing a skirt
Oh, is that how that works?
When somebody talks about how it was Adam first
Does that make you second best?
Or did he save the best for last?

[Chorus]
Sister, shoulder
Daughter, lover
Healer, broken halo
Mother nature
Fire, suit of armor
Soul survivor, Holy Water
Secret keeper, fortune teller
Virgin Mary, scarlet letter
Technicolor, river wild
Baby, girl, woman, child
Female

[Refrain]
Yeah
Female

[Bridge]
She's the heart of life
She's the dreamer's dream
She's the hands of time
She's the queen of kings
See Keith Urban LiveGet tickets as low as $67You might also like[Chorus]
Sister, shoulder
Daughter, lover
Healer, broken halo
Mother nature
Fire, suit of armor
Soul survivor, Holy Water
Secret keeper, fortune teller
Virgin Mary, scarlet letter
Technicolor, river wild
Baby, girl, woman, child
Female

[Outro]
Mhm
Female9Embed",Female,M,N
Thomas Rhett Featuring Riley Green,"Half Of Me Lyrics[Verse 1: Thomas Rhett]
I'm supposed to mow the grass today
I'm supposed to fix the fence
But with the sun beaten down on me
It's hard to make it make sense

[Chorus: Thomas Rhett]
Half of me wants a cold beer
Yeah, that's the cold hard truth
And with the frigerator stocked full of 'em
Tell me what's a boy to do?
I ain't even tryna fight it, it's already been decided
The sky and the mountains are blue
Half of me wants a cold beer
And the other half does too
[Verse 2: Riley Green]
Yeah, I kinda need to wash my truck
But hell, I kinda don't care
I think old Alan Jackson said it best
""It's five o'clock somewhеre""

[Chorus: Riley Green]
Half of me wants a cold beer
Yeah, that's thе cold hard truth
And with the 'frigerator stocked full of 'em
Tell me what's a boy to do?
I ain't even tryna fight it, it's already been decided
The sky and the mountains are blue
Half of me wants a cold beer
Yeah, the other half does too

[Bridge: Thomas Rhett & Riley Green]
Yeah, yeah
Half of me wants a cold beer
If I did what I should be doin' but then that would really ruin all the fun, yeah
There's a world of bad decisions out there, but this ain't one

[Chorus: Thomas Rhett & Riley Green]
'Cause half of me wants a cold, cold beer
Yeah, that's the cold hard truth (Yeah, it is)
And with the 'frigerator stocked full of 'em
Tell me, what's a boy to do?
I ain't even tryna fight it, it's already been decided
The sky and the mountains are blue
Half of me wants a cold beer
And the other half does too
See Thomas Rhett LiveGet tickets as low as $8You might also like[Post-Chorus: Riley Green & Thomas Rhett]
Yeah, half of me wants a cold, cold beer
The other half wants two

[Outro: Riley Green]
Woo-hoo!
That sounds good, but I can't tell if that's your end or notEmbed",Half Of Me,M,N
